{
  "schema_version": 1,
  "manuscript_id": "SYNTHETIC_MVP_20261003",
  "style_version": "style_v0_1_selected",
  "parent": {
    "version": "p2b_b_review_20261007",
    "sha256": "3589678b65dafa7a967b697b133cc17c7d4ca0abc31c02df13ac1e114677e62c"
  },
  "group_registry_version": "style_v0_1_selected",
  "groups": {
    "control": {
      "stable_group_id": "control",
      "display_name": "Control",
      "semantic_role": "control",
      "fill": "#4D4D4D",
      "edge": "#4D4D4D",
      "marker": "circle",
      "line_style": "solid",
      "alpha": 1.0,
      "saturation": 1.0,
      "saturation_behavior": "identity",
      "display_order": 0
    },
    "material": {
      "stable_group_id": "material",
      "display_name": "Material",
      "semantic_role": "comparison",
      "fill": "#0072B2",
      "edge": "#0072B2",
      "marker": "square",
      "line_style": "solid",
      "alpha": 1.0,
      "saturation": 1.0,
      "saturation_behavior": "identity",
      "display_order": 1
    },
    "treatment": {
      "stable_group_id": "treatment",
      "display_name": "Treatment",
      "semantic_role": "intervention",
      "fill": "#D55E00",
      "edge": "#D55E00",
      "marker": "triangle",
      "line_style": "solid",
      "alpha": 1.0,
      "saturation": 1.0,
      "saturation_behavior": "identity",
      "display_order": 2
    }
  },
  "tokens": {
    "width_mm": 89.0,
    "height_mm": 65.0,
    "font_family": "Arial",
    "axis_title_pt": 7.0,
    "tick_pt": 7.0,
    "legend_pt": 7.0,
    "panel_label_pt": 8.0,
    "axis_width_pt": 0.7,
    "tick_width_pt": 0.7,
    "tick_length_pt": 2.5,
    "tick_direction": "out",
    "marker_size_pt": 4.2,
    "raw_marker_size_pt": 2.6,
    "line_width_pt": 1.0,
    "error_width_pt": 0.8,
    "error_cap_pt": 2.0,
    "legend_frame": false,
    "background": "#FFFFFF",
    "grid": false,
    "raw_alpha": 0.75,
    "fill_alpha": 1.0,
    "line_alpha": 1.0,
    "band_alpha": 0.15,
    "layer_left_percent": 18.0,
    "layer_top_percent": 12.0,
    "layer_width_percent": 77.0,
    "layer_height_percent": 68.0,
    "frame": "left_bottom",
    "axis_title_bold": false
  },
  "figures": [
    "FigA",
    "FigB"
  ],
  "feedback": [
    {
      "event_id": "USER_STYLE_B_SELECTION_20261007",
      "scope": {
        "kind": "manuscript",
        "id": "SYNTHETIC_MVP_20261003"
      },
      "status": "accepted",
      "actor": "USER",
      "text": "用户正式选择 Candidate B 为 manuscript working style：left/bottom axes，title/tick/legend=7/7/7 pt，axis/tick=0.7 pt，当前 marker/error hierarchy、raw alpha=0.75 与 stable palette。仅接受论文工作风格方向，不是 PUBLICATION_FINAL_APPROVED；C 不作为 manuscript 默认。",
      "supersedes": null,
      "human_feedback": true
    },
    {
      "event_id": "USER_READER_SCOPE_CONSISTENCY_RULES_20261007",
      "scope": {
        "kind": "manuscript",
        "id": "SYNTHETIC_MVP_20261003"
      },
      "status": "accepted",
      "actor": "USER",
      "text": "用户要求 reader-task、conditional anti-AI、scoped revision 与 manuscript consistency 增量；presentation 从 selected B 派生，只按显示尺寸调整文字/线条重量/必要 spacing，不自动采用 C full box 或 8 pt bold titles。跨 fresh-generation X-title 约0.25 mm 差异为非阻断 v0.1 的已知技术债。",
      "supersedes": null,
      "human_feedback": true
    }
  ],
  "status": "STYLE_V0_1_SELECTED",
  "created_at": "2026-10-07",
  "human_accepted": true
}
